{
  "all_relations_accept": true,
  "assumptions": [
    "fixed Reed-Solomon/Vandermonde generator is MDS over the declared field",
    "SHA-256 Fiat-Shamir transform is modeled as a random oracle",
    "the final subject is binding and grinding is bounded",
    "preprocessing Q is authenticated against the frozen model matrix"
  ],
  "challenge_domain": "aeye/e009/coded-mvm-challenge/v0",
  "challenge_sequence": 4,
  "challenge_source": "fiat-shamir-from-final-subject",
  "conditional_union_bound": {
    "denominator": 879739394437072646331137080735906636585112866347967803758474882198572762381573180545284038373241014982063151504018551605597031414237058297877196988694840183895951260339263524967582736899358576896627155550413988006270707886636874112271387894640275557462239467646428393109423517146315201604838856635931750678801676993822720000000000000000000000000000000000000000000000000000000000000000,
    "numerator": 438581606206150725072319941288939154752013312892506807236645620530685427059445262755701672335265612629471877617213722736518810601372828672832477047380558717501574611475098390051316917616975877242337015295299836915439746787936222509286797119765396279137361182057340475027575186773915411282424539772480678603255055496105725320628705660354290318386746423548142507
  },
  "experiment_id": "E-009",
  "field_prime": 2305843009213693951,
  "relations": [
    {
      "accepted": true,
      "block_length": 6,
      "checks": [
        {
          "accepted": true,
          "challenge": [
            {
              "coefficient": 734306072798521734,
              "position": 1
            },
            {
              "coefficient": 647648564601421792,
              "position": 2
            },
            {
              "coefficient": 46502789770191614,
              "position": 3
            },
            {
              "coefficient": 325427075646830033,
              "position": 5
            }
          ],
          "left": 1560631439454758148,
          "repetition": 0,
          "right": 1560631439454758148
        },
        {
          "accepted": true,
          "challenge": [
            {
              "coefficient": 1406345777714054814,
              "position": 0
            },
            {
              "coefficient": 533528111572670931,
              "position": 3
            },
            {
              "coefficient": 2009229489160080899,
              "position": 4
            },
            {
              "coefficient": 104879173551864411,
              "position": 5
            }
          ],
          "left": 684832591430853512,
          "repetition": 1,
          "right": 684832591430853512
        },
        {
          "accepted": true,
          "challenge": [
            {
              "coefficient": 2015209131605316135,
              "position": 0
            },
            {
              "coefficient": 82379995940624402,
              "position": 2
            },
            {
              "coefficient": 956018433531280629,
              "position": 3
            },
            {
              "coefficient": 1226122262831475361,
              "position": 4
            }
          ],
          "left": 1180923100690619798,
          "repetition": 2,
          "right": 1180923100690619798
        },
        {
          "accepted": true,
          "challenge": [
            {
              "coefficient": 1251763859281074424,
              "position": 0
            },
            {
              "coefficient": 1809779370688913282,
              "position": 2
            },
            {
              "coefficient": 1942518666390775993,
              "position": 3
            },
            {
              "coefficient": 1883327359901285962,
              "position": 5
            }
          ],
          "left": 552335699973712164,
          "repetition": 3,
          "right": 552335699973712164
        },
        {
          "accepted": true,
          "challenge": [
            {
              "coefficient": 486916450990435741,
              "position": 0
            },
            {
              "coefficient": 1482275083928432336,
              "position": 3
            },
            {
              "coefficient": 223619715408001727,
              "position": 4
            },
            {
              "coefficient": 778994613196255079,
              "position": 5
            }
          ],
          "left": 176067487589726148,
          "repetition": 4,
          "right": 176067487589726148
        },
        {
          "accepted": true,
          "challenge": [
            {
              "coefficient": 749176606500646849,
              "position": 1
            },
            {
              "coefficient": 1987588610669750232,
              "position": 2
            },
            {
              "coefficient": 1767892705663121260,
              "position": 3
            },
            {
              "coefficient": 163998919285121653,
              "position": 5
            }
          ],
          "left": 225355284838523021,
          "repetition": 5,
          "right": 225355284838523021
        },
        {
          "accepted": true,
          "challenge": [
            {
              "coefficient": 1281726039167579060,
              "position": 1
            },
            {
              "coefficient": 801995731847104584,
              "position": 2
            },
            {
              "coefficient": 501519442985354942,
              "position": 4
            },
            {
              "coefficient": 83072651226780273,
              "position": 5
            }
          ],
          "left": 2073331757996072263,
          "repetition": 6,
          "right": 2073331757996072263
        },
        {
          "accepted": true,
          "challenge": [
            {
              "coefficient": 1113090235770470530,
              "position": 0
            },
            {
              "coefficient": 1462357787326742988,
              "position": 3
            },
            {
              "coefficient": 940894332019542149,
              "position": 4
            },
            {
              "coefficient": 1057481336224071306,
              "position": 5
            }
          ],
          "left": 2124064255861026762,
          "repetition": 7,
          "right": 2124064255861026762
        },
        {
          "accepted": true,
          "challenge": [
            {
              "coefficient": 1415375338445246136,
              "position": 0
            },
            {
              "coefficient": 1935991774321236362,
              "position": 3
            },
            {
              "coefficient": 2220704366749196015,
              "position": 4
            },
            {
              "coefficient": 217914708218081467,
              "position": 5
            }
          ],
          "left": 1982235569711178808,
          "repetition": 8,
          "right": 1982235569711178808
        },
        {
          "accepted": true,
          "challenge": [
            {
              "coefficient": 155245587457942990,
              "position": 0
            },
            {
              "coefficient": 34578314805787175,
              "position": 2
            },
            {
              "coefficient": 78307329499848111,
              "position": 3
            },
            {
              "coefficient": 1755234004971709191,
              "position": 4
            }
          ],
          "left": 1665221135176488570,
          "repetition": 9,
          "right": 1665221135176488570
        },
        {
          "accepted": true,
          "challenge": [
            {
              "coefficient": 228812411633107531,
              "position": 0
            },
            {
              "coefficient": 1033714714251858885,
              "position": 2
            },
            {
              "coefficient": 1916333809216776239,
              "position": 3
            },
            {
              "coefficient": 1095930013613943694,
              "position": 5
            }
          ],
          "left": 1894291176431537064,
          "repetition": 10,
          "right": 1894291176431537064
        },
        {
          "accepted": true,
          "challenge": [
            {
              "coefficient": 440428910924088821,
              "position": 0
            },
            {
              "coefficient": 1963696803766074703,
              "position": 1
            },
            {
              "coefficient": 507986945495647566,
              "position": 4
            },
            {
              "coefficient": 112399257608274533,
              "position": 5
            }
          ],
          "left": 606039896701261581,
          "repetition": 11,
          "right": 606039896701261581
        },
        {
          "accepted": true,
          "challenge": [
            {
              "coefficient": 661720444452515395,
              "position": 0
            },
            {
              "coefficient": 2014815701676110416,
              "position": 1
            },
            {
              "coefficient": 799311228714863946,
              "position": 4
            },
            {
              "coefficient": 1648515226117430282,
              "position": 5
            }
          ],
          "left": 1722484906211309571,
          "repetition": 12,
          "right": 1722484906211309571
        },
        {
          "accepted": true,
          "challenge": [
            {
              "coefficient": 1262525680955219148,
              "position": 0
            },
            {
              "coefficient": 498964970906762214,
              "position": 1
            },
            {
              "coefficient": 965229684566263686,
              "position": 2
            },
            {
              "coefficient": 1085608572317178390,
              "position": 3
            }
          ],
          "left": 1627437498578064997,